<?xml version="1.0" encoding="UTF-8"?>
<ZY5P7F_orarend
  xmlns:xsi="http://www.w3.org/2001/XMLSchema-instance"
    xsi:noNamespaceSchemaLocation="ZY5P7F_orarend.xsd">
	<ora id="2" tipus="eloadas">
		<targy nev="Vállalati Információs Rendszerek Fejleszése"></targy>
		<idopont>
			<nap napn="Szerda"></nap>
			<tol tolt="14:00"></tol>
			<ig igt="16:00"></ig>
		</idopont>
		<helyszin hol="Inf 103"></helyszin>
		<oktato neve="Dr. Sasvári Péter László "></oktato>
		<szak sznev="Programtervező Informatika"></szak>
	</ora>
	
	<ora id="3" tipus="eloadas">
		<targy nev="Mesterséges Intelligencia"></targy>
		<idopont>
			<nap napn="kedd"></nap>
			<tol tolt="10:00"></tol>
			<ig igt="12:00"></ig>
		</idopont>
		<helyszin hol="A1 32 ea."></helyszin>
		<oktato neve="Dr. Kunné Tamási Judit"></oktato>
		<szak sznev="Programtervező Informatika"></szak>
	</ora>
	
	<ora id="4" tipus="eloadas">
		<targy nev="Adatkezelés XML-ben"></targy>
		<idopont>
			<nap napn="szerda"></nap>
			<tol tolt="8:00"></tol>
			<ig igt="10:00"></ig>
		</idopont>
		<helyszin hol="T050"></helyszin>
		<oktato neve="Prof. Dr. Kovács László"></oktato>
		<szak sznev="Programtervező Informatika"></szak>
	</ora>

	<ora id="7" tipus="gyakorlat">
		<targy nev="Vállalati Információs Rendszerek Fejlesztése"></targy>
		<idopont>
			<nap napn="szerda"></nap>
			<tol tolt="18:00"></tol>
			<ig igt="20:00"></ig>
		</idopont>
		<helyszin hol="Inf 103"></helyszin>
		<oktato neve="Dr. Sasvári Péter László"></oktato>
		<szak sznev="Programtervező Informatika"></szak>
	</ora>
	
	<ora id="8" tipus="gyakorlat">
		<targy nev="Adatkezelés XML-ben"></targy>
		<idopont>
			<nap napn="szerda"></nap>
			<tol tolt="10:00"></tol>
			<ig igt="12:00"></ig>
		</idopont>
		<helyszin hol="Inf 101"></helyszin>
		<oktato neve="Dr. Bednarik László"></oktato>
		<szak sznev="Programtervező Informatika"></szak>
	</ora>
	
	<ora id="11" tipus="gyakorlat">
		<targy nev="Mesterséges Intelligencia"></targy>
		<idopont>
			<nap napn="kedd"></nap>
			<tol tolt="12:00"></tol>
			<ig igt="14:00"></ig>
		</idopont>
		<helyszin hol="A1 32 ea."></helyszin>
		<oktato neve="Fazekas Levente"></oktato>
		<szak sznev="Programtervező Informatika"></szak>
	</ora>
	
</ZY5P7F_orarend>
	